{
  "version": "1.1",
  "http": [
    {
      "name": "上交所commonExcelKcb",
      "url": "https://query.sse.com.cn/commonExcelKcb.do?sqlId=SH_XM_LB",
      "method": "GET",
      "kind": "xls",
      "headers": { "Referer": "https://www.sse.com.cn/" },
      "note": "上交所科创板 IPO 审核"
    },
    {
      "name": "上交所再融资",
      "url": "https://query.sse.com.cn/commonExcelKcb.do?sqlId=GP_ZRZ_XMLB",
      "method": "GET",
      "kind": "xls",
      "headers": { "Referer": "https://www.sse.com.cn/" }
    },
    {
      "name": "上交所并购重组",
      "url": "https://query.sse.com.cn/commonExcelKcb.do?sqlId=GP_BGCZ_XMLB",
      "method": "GET",
      "kind": "xls",
      "headers": { "Referer": "https://www.sse.com.cn/" }
    },
    {
      "name": "深交所IPO",
      "url": "https://www.szse.cn/api/ras/projectrends/query?bizType=1&random=0.5&start=0&pageSize=100",
      "method": "GET",
      "kind": "json",
      "headers": {
        "Referer": "https://listing.szse.cn/projectdynamic/ipo/index.html",
        "X-Request-Type": "ajax"
      },
      "note": "分页可能失效；全量走 iFinD 兜底"
    },
    {
      "name": "深交所再融资",
      "url": "https://www.szse.cn/api/ras/projectrends/query?bizType=2&random=0.5&start=0&pageSize=100",
      "method": "GET",
      "kind": "json",
      "headers": { "Referer": "https://listing.szse.cn/projectdynamic/ipo/index.html" }
    },
    {
      "name": "深交所并购",
      "url": "https://www.szse.cn/api/ras/projectrends/query?bizType=3&random=0.5&start=0&pageSize=100",
      "method": "GET",
      "kind": "json",
      "headers": { "Referer": "https://listing.szse.cn/projectdynamic/ipo/index.html" }
    },
    {
      "name": "北交所infoResult",
      "url": "https://www.bse.cn/projectNewsController/infoResult.do",
      "method": "POST",
      "kind": "json",
      "headers": {
        "Referer": "https://www.bse.cn/",
        "Content-Type": "application/x-www-form-urlencoded"
      },
      "body": {
        "statetypes[]": "P01,P02,P03,P05,P06,P07",
        "page": "1"
      },
      "note": "WAF 已知问题（ConnectionResetError 10054），失败走媒体降级"
    },
    {
      "name": "证监会eid.csrc.gov.cn",
      "url": "http://eid.csrc.gov.cn/fd.html",
      "method": "GET",
      "kind": "html",
      "headers": { "User-Agent": "Mozilla/5.0" },
      "note": "必须 http 非 https（SSL 握手失败）"
    },
    {
      "name": "hkexnews披露易",
      "url": "https://www1.hkexnews.hk/search/titlesearch.xhtml?lang=zh",
      "method": "GET",
      "kind": "html"
    },
    {
      "name": "巨潮资讯",
      "url": "http://www.cninfo.com.cn/new/index",
      "method": "GET",
      "kind": "html",
      "headers": { "User-Agent": "Mozilla/5.0" }
    }
  ],
  "mcp": [
    {
      "name": "mcp__qveris__discover",
      "smoke_hint": "用 discover 检索 1 类所需数据（如 A股IPO），确认其聚合的远程工具",
      "note": "工具仓库：先 discover 再 call；按量计费，作降级/交叉验证补充"
    },
    {
      "name": "mcp__mx-ds-mcp__mx_ashare_finance_data",
      "smoke_hint": "取 1 只 A 股基本资料样例"
    },
    {
      "name": "mcp__mx-ds-mcp__mx_hk_finance_data",
      "smoke_hint": "取 1 只港股基本资料样例"
    },
    {
      "name": "mcp__mx-ds-mcp__mx_index_block_finance_data",
      "smoke_hint": "取指数/板块行情样例"
    },
    {
      "name": "mcp__hexin-ifind-ds-stock-mcp__get_stock_summary",
      "smoke_hint": "取 1 只股票摘要"
    },
    {
      "name": "ifind-quant HTTP（本地脚本通道，非MCP）",
      "smoke_hint": "运行 ifind-quant/smoke_test.py，按行回写通道实测.jsonl；一键重采用 collect_core.py --pack <pack> --ym <YYYY-MM>",
      "note": "同花顺云端量化接口 quantapi.51ifind.com；token 在 ifind-quant/credentials.json；Agent 运行本地脚本后回写实测结果"
    },
    {
      "name": "mcp__hexin-ifind-ds-stock-mcp__get_stock_performance",
      "smoke_hint": "取 1 只股票阶段行情"
    },
    {
      "name": "mcp__hexin-ifind-ds-stock-mcp__get_stock_financials",
      "smoke_hint": "取 1 只股票财务数据"
    },
    {
      "name": "mcp__hexin-ifind-ds-news-mcp__search_news",
      "smoke_hint": "搜 1 条新闻原文"
    },
    {
      "name": "mcp__hexin-ifind-ds-news-mcp__search_notice",
      "smoke_hint": "搜 1 条上市公司公告"
    },
    {
      "name": "mcp__wind_stock_data__get_stock_basicinfo",
      "smoke_hint": "取 1 只股票档案"
    },
    {
      "name": "mcp__wind_stock_data__get_stock_kline",
      "smoke_hint": "取 1 只股票 K 线"
    },
    {
      "name": "mcp__wind_stock_data__get_stock_fundamentals",
      "smoke_hint": "取 1 只股票财务"
    },
    {
      "name": "mcp__wind_stock_data__get_stock_price_indicators",
      "smoke_hint": "取 1 只股票时点行情"
    },
    {
      "name": "mcp__itjuzi-mcp__search_events",
      "smoke_hint": "检索近 30 天融资事件 1 页"
    },
    {
      "name": "mcp__itjuzi-mcp__aggregate_funding_by_tags",
      "smoke_hint": "按标签聚合融资事件"
    },
    {
      "name": "mcp__mcp__get_data",
      "smoke_hint": "get_table_columns 任意烯牛表"
    },
    {
      "name": "mcp__tavily-search__tavily_search",
      "smoke_hint": "检索 1 条政策原文"
    },
    {
      "name": "mcp__qcc-document__parse_document",
      "smoke_hint": "解析 1 页测试 PDF"
    },
    {
      "name": "mcp__stock-sdk__get_a_share_quotes",
      "smoke_hint": "取 1 只 A 股实时快照"
    },
    {
      "name": "mcp__stock-sdk__get_history_kline",
      "smoke_hint": "取 1 只 A 股历史 K 线"
    },
    {
      "name": "mcp__stock-sdk__get_industry_list",
      "smoke_hint": "取 1 个行业板块列表"
    },
    {
      "name": "mcp__cninfo__download_annual_reports_tool",
      "smoke_hint": "取 1 份年报 PDF"
    },
    {
      "name": "mcp__qcc-company__get_company_profile",
      "smoke_hint": "取 1 家企业工商画像"
    },
    {
      "name": "mcp__qcc-company__get_company_registration_info",
      "smoke_hint": "取 1 家企业工商登记"
    },
    {
      "name": "mcp__qcc-company__get_financing_records",
      "smoke_hint": "取 1 家企业融资记录"
    },
    {
      "name": "mcp__akshare__get_realtime_data",
      "smoke_hint": "取 1 只 A 股实时数据"
    },
    {
      "name": "mcp__akshare__get_hist_data",
      "smoke_hint": "取 1 只 A 股历史数据"
    },
    {
      "name": "mcp__tushare__sdk_call",
      "smoke_hint": "调用 1 次 Tushare API"
    }
  ],
  "agent": [
    {
      "name": "subagent",
      "smoke_hint": "派 1 个最小子任务（返回一句话即可）"
    },
    {
      "name": "workflow",
      "smoke_hint": "跑 1 个 agent() 最小编排"
    }
  ]
}